{
  "$schema": "https://json-schema.org/draft/2020-12/schema",
  "$id": "https://example.invalid/schemas/dataset.schema.json",
  "type": "object",
  "additionalProperties": false,
  "required": ["schema_version", "id", "version", "description", "cases"],
  "properties": {
    "schema_version": {"const": "1.0"},
    "id": {"type": "string", "pattern": "^[a-z0-9][a-z0-9-]+$"},
    "version": {"type": "string", "pattern": "^[0-9]+\\.[0-9]+\\.[0-9]+$"},
    "description": {"type": "string", "minLength": 1},
    "cases": {
      "type": "array",
      "minItems": 1,
      "uniqueItems": true,
      "items": {"type": "string", "pattern": "^cases/.+/case\\.json$"}
    }
  }
}
